{
  "schema": "castalia.connected-accounts.v1-draft",
  "version": 1,
  "authority": "descriptor-only",
  "ownerMemberKey": "d75a980182b10ab7d54bfed3c964073a0ee172f3daa62325af021a68f707511a",
  "accounts": [
    {
      "accountId": "11111111-1111-4111-8111-111111111111",
      "kind": "nostr",
      "networkId": "nostr",
      "identifier": "79be667ef9dcbbac55a06295ce870b07029bfcdb2dce28d959f2815b16f81798",
      "publicKey": {
        "suite": "BIP340-secp256k1",
        "encoding": "lowercase-hex",
        "value": "79be667ef9dcbbac55a06295ce870b07029bfcdb2dce28d959f2815b16f81798"
      }
    },
    {
      "accountId": "22222222-2222-4222-8222-222222222222",
      "kind": "matrix",
      "networkId": "matrix:example.org",
      "identifier": "@alice:example.org",
      "homeserver": "https://matrix.example.org"
    },
    {
      "accountId": "33333333-3333-4333-8333-333333333333",
      "kind": "evm",
      "networkId": "eip155:1",
      "identifier": "0x0000000000000000000000000000000000000000"
    }
  ]
}
